reviewId,text
ChZDSUhNMG9nS0VJQ0FnSUNBNnNibkJnEAE,
ChdDSUhNMG9nS0VJQ0FnSUNnc0o3Mm9BRRAB,"Decaf Americano has no body or flavor, mouth feel chalky."
ChZDSUhNMG9nS0VJQ0FnSURRbmNHTlFBEAE,"They use oat milk, which I had not tried before - it's delicious! I also loved the chia pudding.
Recommended for any coffee lover, vegan or not!
They have non-coffee drinks as well, like golden milk (turmeric honey) and others."
ChdDSUhNMG9nS0VJQ0FnSUN3cW9IRnhBRRAB,
ChdDSUhNMG9nS0VJQ0FnSURBd0xXV21BRRAB,
ChZDSUhNMG9nS0VJQ0FnSUNBX05IaFVBEAE,"Three happy vegans had a jolly time here. They use oat milk which is my fav. Everything is nice, clean, and organized. 10/10 stop by."
ChZDSUhNMG9nS0VJQ0FnSURBZ1lHU0ZBEAE,"Staff were ready and willing to explain the ingredients and process of several drinks. My drink was delicious though dainty. There's not a whole lot of seating, but there are a few more tables out back in the nicely shaded alley."
ChdDSUhNMG9nS0VJQ0FnSUNBMnNXVmdBRRAB,
ChdDSUhNMG9nS0VJQ0FnSURncEstMG1nRRAB,Best coffee in Omaha
ChZDSUhNMG9nS0VJQ0FnSUNnb1lmT0JREAE,
ChZDSUhNMG9nS0VJQ0FnSUN3cnByc1ZREAE,
ChZDSUhNMG9nS0VJQ0FnSUNnbjh6TUJBEAE,Amazing coffee and friendly staff! They know their craft!
ChdDSUhNMG9nS0VJQ0FnSUN3N1lYRjVBRRAB,
ChZDSUhNMG9nS0VJQ0FnSUN3M3VTNURBEAE,Glad I ran across this little gem while visiting Omaha.  My oat milk latte was smooth and delicious.  Will be back in the morning for another latte and also to try some of the food offerings.
ChZDSUhNMG9nS0VJQ0FnSUNnejhDcEtREAE,"Great coffee, friendly staff. Nice view"
ChdDSUhNMG9nS0VJQ0FnSURnMk42WXVnRRAB,
ChdDSUhNMG9nS0VJQ0FnSUNnaHREbDV3RRAB,The house blend is delicious! Coffee Subscription is so convenient. I am officially an addict.
ChdDSUhNMG9nS0VJQ0FnSURRM3JUNm5BRRAB,Has the best vegan chocolate chip walffes
ChdDSUhNMG9nS0VJQ0FnSUNBc2NfTHl3RRAB,
ChZDSUhNMG9nS0VJQ0FnSUNBZy1iZlZ3EAE,Perfect!
ChdDSUhNMG9nS0VJQ0FnSURRcE9peHRRRRAB,"They never fail to disappoint! My favorite coffee shop in town. (Ok maybe ever) It is vegan but that's not it's best feature. The staff are just as amazing as everything on their menu. Everyone I know that's been loves it. Lots of variety, if you are indecisive they are happy to help! Make sure to try this place. :-)"
ChdDSUhNMG9nS0VJQ0FnSUNRXy1HWV9nRRAB,"Great coffee, great food, great people. Chill, hipster vibe. If you have food allergies, everything is disclosed on the menu. The music was on point."
ChZDSUhNMG9nS0VJQ0FnSUN3ZzltOEhnEAE,"You can tell the owners at Amateur Coffee love what they do. It’s unique that all the seating is at two countertops with bar stools (or the patio outside) so you sit quite close to the baristas. Because you sit in such close proximity to the baristas, interaction with them is easy and its obvious to see that the owners love what they do. The shop is quite and clean. Atmosphere is quiet. I met clients there and it was easy to have our conversation and enjoy great coffee."
ChZDSUhNMG9nS0VJQ0FnSUNRejZmMmNnEAE,Such a cool space. The staff is very friendly and the coffee is amazing!!!
ChdDSUhNMG9nS0VJQ0FnSUNBNExhLWp3RRAB,"Always a pleasant experience. They are very knowledgeable about coffee and tea. Out of all the roasters in town, Amateur is by far the best."
ChZDSUhNMG9nS0VJQ0FnSUNBd01ubWNnEAE,Just amazing coffee and staff. Would gladly go back
ChZDSUhNMG9nS0VJQ0FnSURnNXB6RElnEAE,"I went to visit Amateur Coffee after searching for Vegan food in Omaha and it was one of two options that popped up. I'm so glad I took the time to go here. The staff was incredible and the coffee was top notch, I will definitely go here again when visiting Omaha. When I told them I was searching for places to get good vegan food they actually wrote out a list for me of where to go and what to get. Thank you all so much!"
ChdDSUhNMG9nS0VJQ0FnSUNnNXVxeTlBRRAB,Always try to support Vegan establishments whenever I’m in a city. This place didn’t disappoint. The jade matcha and rose latte was delicious and I got a lemon blueberry blackberry scone that hit the spot.
ChdDSUhNMG9nS0VJQ0FnSURRbzlEWS1RRRAB,The oatmeal-based milk creates a really yummy latte. The owners are super friendly. We’re excited to have them in the neighborhood!
ChdDSUhNMG9nS0VJQ0FnSUN3bHFPLXRBRRAB,
ChZDSUhNMG9nS0VJQ0FnSUNRbHV1c0tREAE,
ChdDSUhNMG9nS0VJQ0FnSUNRdklDYThBRRAB,
ChZDSUhNMG9nS0VJQ0FnSURnb2ItWkhREAE,
ChdDSUhNMG9nS0VJQ0FnSUNneF9EampBRRAB,Great coffee. Great staff. Great space. This place is really awesome and has become my go to when visiting Omaha.
ChdDSUhNMG9nS0VJQ0FnSUNnNW9PMl9nRRAB,"Hubby and I made it a point to go here first on our trip to Omaha, and it did not disappoint! We have tried several things on the menu and all were amazing! We will be going back often:) I suggest the waffles and the golden milk for sure! Wish we could take them home with us;)"
ChZDSUhNMG9nS0VJQ0FnSUNnaWZpVWZREAE,Great new addition to the Omaha coffee scene
ChdDSUhNMG9nS0VJQ0FnSURRbzR6dDRRRRAB,
ChdDSUhNMG9nS0VJQ0FnSURnNF8zRTVBRRAB,
ChdDSUhNMG9nS0VJQ0FnSURnamV2MjN3RRAB,Amazing vegan coffee drinks in an intimate space! Great roasts and great people.
ChZDSUhNMG9nS0VJQ0FnSURnaV9iU0hnEAE,Tried the turmeric latte (made with oat milk - this place is vegan!) and it's amazing
ChdDSUhNMG9nS0VJQ0FnSUNnNzkzRmxnRRAB,"Love every single detail of this all-vegan cafe. Their brand of oat milk, Oatly is the best animal milk substitute I’ve ever tasted. Jasmyn and Jacob pour their knowledge and TLC into each hand-crafted offering on their menu.
Pro-tip: Sign up for their rewards program.
 “Love Something More” ❤️"
ChdDSUhNMG9nS0VJQ0FnSUNRdmZHSDJBRRAB,"Great little coffee shop. The owners staff the shop and are super friendly and helpful. Great customer service, great coffee. Tiny little shop so you may want to get an order to go. The pastries are lovely and the waffles are super yummy.  Everything is vegan which is great for us plant based folks and those non vegans will still enjoy it. It is so nice have a vegan coffee shop in Omaha!"
ChZDSUhNMG9nS0VJQ0FnSURnd3BMd0pnEAE,I’ve been in many times before for the excellent coffee and lattes. Today I had the waffle and turmeric latte. Both were amazing. Such a good vibe
ChZDSUhNMG9nS0VJQ0FnSUNRbHNYSEZnEAE,
ChdDSUhNMG9nS0VJQ0FnSURnaUxHUHpBRRAB,"Beautiful esthetic, delicious vegan treats and coffee drinks!"
ChdDSUhNMG9nS0VJQ0FnSUN3bk9URnpnRRAB,"Coffee was good! Flavor was different because of the okay milk- not a bad thing! It's a very cute little coffee shop. They need to hire help though, they didn't stop moving the whole time we were there!"
ChZDSUhNMG9nS0VJQ0FnSUNBejRMSE9BEAE,Great service! We had a last minute coffee emergency and they saved the day!! Thank thank
ChZDSUhNMG9nS0VJQ0FnSUNnM1BiVWF3EAE,Wonderful vibe! Great coffee. Obvious that they know how to roast coffee in a way to coax out the best flavors of the bean. Great space to relax and visit with a friend.
ChdDSUhNMG9nS0VJQ0FnSUN3cUltcTJBRRAB,"Everything was fantastic, the owners are really nice and informative about there products and are willing to explain any questions you have, there vegan pastries and coffee are the best I've ever had!!!"
ChZDSUhNMG9nS0VJQ0FnSURBbUxMb0V3EAE,
ChZDSUhNMG9nS0VJQ0FnSURnaE1hdEt3EAE,Great coffee with vegan focus. Waffles are fantastic.
ChZDSUhNMG9nS0VJQ0FnSURnOE9PRkJ3EAE,Amazing vegan coffee and vegan pastries! Will return again and again!
ChdDSUhNMG9nS0VJQ0FnSURnc2NyOW13RRAB,I am estatic to have a Vegan Cafe in Omaha. Not only that everything I tried was outstanding. I've never had a better cappuccino. The owners are absolutely delightful. The do have a high chair option which greatly impressed me. The owners said they loved kids which was really comforting because my son definitely left crumbs from his pastries. Looking forward to many stops and trying many beverages.
ChdDSUhNMG9nS0VJQ0FnSURRNXVmSG1BRRAB,Great spot!  Not a ton of room but great drinks including a good selection of teas and non-coffee items.  Try the tumeric latte!
ChdDSUhNMG9nS0VJQ0FnSUNBMmFLajdnRRAB,
ChZDSUhNMG9nS0VJQ0FnSUN3d0x2c053EAE,"The staff is terrifically friendly. They engage early and often with customers ensuring their needs and met. The food and coffee is vegan oriented, which isn't for me, but the tea and atmosphere are wonderful. It's small and cozy which is just what I'm looking for in a local place."
ChZDSUhNMG9nS0VJQ0FnSUNRbllLLVp3EAE,